importance,name,category
9.185786038292265e-05, Grand Opening, Legion Raid
9.185078653017118e-05, A Mask for All Occasions, Hallow's End
9.16994581182198e-05, Nothing Boring About Borean, Northrend
9.142928736496399e-05, Supreme Defender, Warsong Gulch
9.1344565108669e-05, Exalted Champion of the Exodar, Argent Tournament
9.120326482933583e-05, How To Strain Your Dragon, Pandaria
9.11814798112665e-05, They're Coming Out of the Walls (10 player), Raids
9.117720043311826e-05, Pit Lord Argaloth, Tol Barad
9.101235136464371e-05, Everything Tastes Better, Cooking
9.086659924476153e-05, Criss Cross, Pandaria Raid
9.078391350526725e-05, I Was Framed!, Draenor
9.060549136776831e-05, Realm First! Grand Crusader, Feats of Strength
9.026695521767283e-05, Kite Fight, Pandaria Scenarios
9.008394977604748e-05, Dead Man's Party, World Events
8.998087844703753e-05, Headed South, Cataclysm Dungeon
8.97773490016358e-05, You Said Crossing the Streams Was Bad, Pandaria Raid
8.943593074883347e-05, Exalted Champion of Sen'jin, Argent Tournament
8.935943631424837e-05, Instant Karma, Legion Dungeon
8.9259186130803e-05, Don't Sweat the Technique, Legion Raid
8.917724136608455e-05, A Quick Shave (10 player), Raids
8.915948171472123e-05, Blue Response, Pandaria
8.903585357245059e-05, Listen to the Drunk Fish, Pandaria
8.900811060016084e-05, Heroic: Tour of War, War Effort
8.873865332390821e-05, 7th Legion Spycatcher, Battle for Azeroth
8.845886761679437e-05, You Mean That Wasn't a Void Zone?, Pandaria Scenarios
8.843708388476493e-05, Diversified Investments, Battle for Azeroth
8.796680239070004e-05, A Fungus Among Us, Draenor Raid
8.780689499873798e-05, Sharing is Caring, Pilgrim's Bounty
8.780108012732475e-05, Grin and Bear It, Legion Raid
8.77587953236508e-05, Queuing Spree, Pandaria Scenarios
8.763574445137298e-05, No Tank You, Pandaria Scenarios
8.761286556589535e-05, Northern Barrens Quests, Kalimdor
8.756526096783136e-05, Must Love Dogs, Pandaria Raid
8.756350807986433e-05, What's Your Sign?, Draenor Dungeon
8.731800335258066e-05, You Runed Everything!, Legion Raid
8.713615063178444e-05," Where There's Pirates, There's Booty", Pandaria
8.700914353420604e-05, Go Long, Pandaria Raid
8.690371051990657e-05, They See Me Rolling, Legion
8.684851143042235e-05, Defense of the Ancients, Player vs. Player
8.68175872020013e-05, One Two Three You Don't Know About Me, Battle for Gilneas
8.655848438986902e-05, Turning the Tide, Draenor Raid
8.646599900509465e-05, Ruby Void, Lich King Dungeon
8.635858402654486e-05, Full Coverage, Battle for Gilneas
8.632872476164525e-05, The Twilight Destroyer (10 player), Lich King Raid
8.627912708405062e-05, King of the Spider-Hill, Cataclysm
8.620352144981954e-05, Now We're Cookin', Pilgrim's Bounty
8.60587373430031e-05, Orbit-uary (10 player), Raids
8.5833626719657e-05, Crazy Cat Lady (10 player), Raids
8.575738054712857e-05, Warbound Veteran of the Alliance, Rated Battleground
8.558575861104909e-05, Quarrelsome Quilen Quintet, Pandaria Dungeon
8.54051480905883e-05, Make It Count, Lich King Dungeon
8.529681979652644e-05, Amber Void, Lich King Dungeon
8.522495248223209e-05, Adventurer of Nazmir, Battle for Azeroth
8.503638101159153e-05, Jawless Skulker Angler, Fishing
8.491217852381538e-05, Shot Through the Heart, Battle Dungeon
8.487749508732215e-05, Heroic: The Botanica, The Burning Crusade
8.451999182169607e-05, Realm First! Level 80 Draenei, Feats of Strength
8.400877583295674e-05, Pitch Invasion, Battle Dungeon
8.38632946574453e-05, Ready for RAAAAIIIIDDD?!?ing, Pandaria
8.38251008979246e-05, Bad Manner(oth), Draenor Raid
8.377993561081492e-05, I'm a Soul Man, Draenor Raid
8.372926740464119e-05, 1000 Dungeon & Raid Emblems, Currencies
8.345114712088996e-05, Savage Hero, Dungeons & Raids
8.328934927118392e-05, Run with the Wind, Pandaria Dungeon
8.31949336626439e-05, Glorious!, Pandaria
8.309050055325197e-05, Let's Do Lunch: Thunder Bluff, Cooking
8.28078559248492e-05, The Incredible Hulk, Lich King Dungeon
8.276533927895942e-05, Fire in the Hole!, Pandaria Raid
8.267055676416048e-05, Heroic: The Escape From Durnholde, The Burning Crusade
8.25192037995103e-05, Simple Geometry, Battle Raid
8.204733393624203e-05, Fruit of All Evil, Legion Raid
8.200834897572728e-05, In the Eye of the Tiger, Pandaria Scenarios
8.197108433415055e-05, Elders of the Dungeons, Lunar Festival
8.182046581482694e-05, Don't Look Up, Lich King Dungeon
8.167787325570687e-05," We Got Spirit, How About You?", Battle Raid
8.151420280801956e-05, Fish or Cut Bait: Stormwind, Fishing
8.09612848122376e-05, Hard Boiled, Noblegarden
8.095341675711806e-05, Worm-monger, Legion Raid
8.093820369168298e-05, No More Tears, Pandaria Raid
8.078776904533479e-05, Champions of Lei Shen, Pandaria
8.066839647597885e-05, Realizing Your Potential, Battle Raid
8.065872872219065e-05, Rotten Hallow, Hallow's End
8.009377624928258e-05, The Obvious Solution, Pandaria Dungeon
8.000695402181897e-05, I Made a Food!, Legion Dungeon
7.982030725580936e-05," Fish Gotta Swim, Birds Gotta Eat", Draenor
7.975585968859542e-05, Timing is Everything, Pandaria Raid
7.917121919456196e-05, This Is Why We Can't Have Nice Things, Draenor Dungeon
7.910331849790767e-05, Tranquil Master, Dungeons & Raids
7.881722423093275e-05, Ogre Observer, Archaeology
7.874278367304086e-05, How to Train Your Direhorn, Battle for Azeroth
7.853986532283266e-05, Bottle Service (Season 2), Legacy
7.853757597437304e-05, Killed in Quel'Thalas, Player vs. Player
7.811485349588693e-05, I Attack the Darkness, Legion Raid
7.769817431061434e-05, Taste the Rainbow!, Cataclysm Raid
7.748943802347036e-05," A Specter, Illuminated", Legion Dungeon
7.738911200257684e-05, Highmaul Historian, Archaeology
7.73500100583771e-05, Tricks and Treats of Outland, Hallow's End
7.705398241249919e-05, Mine Mine Mine!, Silvershard Mines
7.6869551926126e-05, Dark Heart of Pandaria, Pandaria Scenarios
7.672154796440834e-05, How? Isn't it Obelisk?, Battle Raid
7.65441258542686e-05," Hurry Up, Maggot!", Draenor Raid
7.646833469361196e-05, Timeless Nutriment, Pandaria
7.584114656836352e-05," I Choose You, Runemaster Molgeim (10 player)", Raids
7.57803172169709e-05, Territorial Dominance, Arathi Basin
7.57410014671195e-05, Black Rook Moan, Legion Dungeon
7.563325660022195e-05, I Hate That Song, Cataclysm Dungeon
7.55692117393008e-05, Lactose Intolerant, Battle Raid
7.548118206088754e-05, Sun of a...., Cataclysm Dungeon
7.529992276461319e-05, Hopocalypse Now!, Pandaria Dungeon
7.506039216823268e-05, Unite the Clans, Archaeology
7.479748802391504e-05, The Void Lies Sleeping, Battle Dungeon
7.464498024823058e-05, Gotta Bounce, Battle Raid
7.432886667103397e-05, Fairegoer's Feast, Darkmoon Faire
7.408304130881176e-05, Imagined Dragons World Tour, Legion Raid
7.40401426151805e-05, Yak Attack, Pandaria
7.402505999300623e-05, Arrested Development, Cataclysm Dungeon
7.383971327552279e-05," Anything You Can Do, I Can Do Better...", Pandaria Raid
7.36336752083912e-05," Great Soul, Great Purpose", Legion Raid
7.358589080014886e-05, Ironsides, Draenor Garrison
7.350230309183957e-05, Burning Man, Pandaria Dungeon
7.340046253238934e-05, Can't Eat Just One, Legion Dungeon
7.303717338148183e-05, Conscriptinator, Pandaria Dungeon
7.296819702233758e-05, Mysteries of the Marsh, Outland
7.294647399416651e-05, Total Annihilation, Battle Raid
7.293242721372132e-05, Take Them Out, Ashran
7.269297925199021e-05, Strength and Honor, Archaeology
7.2679324983046e-05, What Does This Button Do?, Pandaria Dungeon
7.266912551988103e-05, A-bomb-ination, Isle of Conquest
7.252141215438112e-05, Immortal No More, Player vs. Player
7.245882815518292e-05, Kul Runnings, Battle for Azeroth
7.212790162005132e-05, Supreme Defender, Warsong Gulch
7.190276182544889e-05, Aberrant Behavior, Cataclysm Raid
7.1707944568767e-05, Battlefield Master, Honor
7.169090126830852e-05, Southern Barrens Quests, Kalimdor
7.160154768546361e-05, Veteran of the Horde II, Rated Battleground
7.119075452659396e-05, To the Ground!, Cataclysm Dungeon
7.116856372009532e-05, You and What Army?, Battle Raid
7.077173081866258e-05," I Choose You, Stormcaller Brundir (10 player)", Raids
7.01511077251052e-05, Arakkoa Archivist, Archaeology
6.989485656597785e-05, Edgelords, Battle Raid
6.988651913086125e-05, Locking Down the Docks, Fishing
6.978655689019757e-05, Snow Fun Allowed, Battle Raid
6.97428942716563e-05, Hot Swapper, Professions
6.973859834277961e-05, Nation of Adoration, Love is in the Air
6.958560704784734e-05, Bless the Rains Down in Freehold, Battle for Azeroth
6.95457179413331e-05," Ashes, Ashes...", Draenor Raid
6.950011013134176e-05," Militaristic, Expansionist", Draenor Dungeon
6.936648589629908e-05, 5 Daily Quests Completed, Quests
6.917847428824734e-05, Nothing To Scry About, Battle for Azeroth
6.91678403942073e-05, Consumption Junction, Lich King Dungeon
6.887677960921679e-05," Boldly, You Sought the Power of Ragnaros", Events
6.886284031126461e-05, Realm First! Grand Master Blacksmith, Feats of Strength
6.885650068696191e-05, Scenaturday, Pandaria Scenarios
6.858516116856543e-05, Extra Credit Bonus Stage, Cataclysm Dungeon
6.858093161244455e-05, Draenor's Last Stand, Draenor
6.839147056571426e-05, Rumble Club, Brawler's Guild
6.832706991198488e-05, Soaring Spirits, Twin Peaks
6.830682121326512e-05, I Got What You Mead, Legion Dungeon
6.808215929631285e-05, Legion Curator, Archaeology
6.800792034840648e-05, Escort Service, Silvershard Mines
6.79471754358298e-05, Orgrimmar Offensive, Player vs. Player
6.770351614116302e-05, Available in Eight Colors, Mounts
6.761347726825334e-05, I Ain't Even Cold, Legion Dungeon
6.757874073183574e-05, Supermassive (25 player), Raids
6.754048522230719e-05, Pandaren Cuisine, Pandaria
6.74217883791628e-05, Night Moves, War Effort
6.741275320302766e-05, I'm in Charge Now!, Battle Dungeon
6.698641758078188e-05, Cataclysmically Delicious, Cataclysm
6.698059436937178e-05," You Can Pet the Dog, But...", Battle Raid
6.646224603819004e-05, The Right Stuff, Character
6.613047357481228e-05, Let's Do Lunch: Orgrimmar, Cooking
6.603818960255187e-05, Iron Chef, Cooking
6.595742105654792e-05, I Got Next!, Battle Raid
6.59316792770018e-05, I Heard You Like Amber..., Pandaria Raid
6.514513675903468e-05, Faster Than the Speed of Light, Cataclysm Dungeon
6.511265756403844e-05, The Best of Us, Battle Raid
6.506132969162264e-05, School's Out Forever, Pandaria Dungeon
6.481782891411888e-05, Hate Leads to Suffering, Pandaria Dungeon
6.477245431128549e-05, Fungalophobia, Cataclysm
6.469368156388343e-05, Who's Afraid of the Dark?, Legion Dungeon
6.464308256590981e-05, Leader of Troops, War Effort
6.423631116039819e-05, Scenaturday, Pandaria Scenarios
6.360653734203054e-05, Triumphant Turtle Tossing, Darkmoon Faire
6.359487940601893e-05, Overzealous, Pandaria Raid
6.357401909468518e-05, Hidden Dragon, Battle Raid
6.35593710965304e-05, Ironpaw Chef, Cooking
6.354302736063596e-05, Magnify... Enhance, Draenor Dungeon
6.335604034297138e-05, Double Dribble, Battle Raid
6.322481505653084e-05, Bridge Over Troubled Fire, Draenor Dungeon
6.321460118988113e-05, From Hell's Heart I Stab at Thee, Cataclysm
6.306884214440707e-05, Crypt of Forgotten Kings, Pandaria Scenarios
6.296446321045138e-05, Outland Angler, Fishing
6.295521688679944e-05, Shadow of the Betrayer, Outland
6.281400748043877e-05, In His House He Waits Dreaming (10 player), Raids
6.276901517838982e-05, Five Course Seafood Buffet, Legion Raid
6.234736681179562e-05, Waiting for Gerdo, Legion Dungeon
6.231023838779229e-05, Head Case, Pandaria Raid
6.230241927567578e-05, Cleansing Treatment, Battle Raid
6.188589495768916e-05, Kiss and Make Up (10 player), Raids
6.168904218684439e-05, Seeds of Doubt, Pandaria Dungeon
6.167272811895868e-05, Secrets of Skettis, Archaeology
6.046869091197372e-05, Tol Barad Veteran, Tol Barad
6.038752891474733e-05, Icky Ichors, Draenor Dungeon
6.0325092139014445e-05, I've Got My Eyes On You, Legion Raid
6.022997832772907e-05, A Gift of Earth and Fire, Draenor Dungeon
6.0198958269514414e-05, Bound for Glory, Eye of the Storm
6.007430923347814e-05, Fighting with Style: Upgraded, Legion Class Hall
6.005468059402708e-05, Soft Hands, Pandaria Raid
5.9863607941811854e-05," Wax On, Wax Off", Legion Raid
5.984708862865943e-05, Keepin' Busy, Draenor Garrison
5.960470690957422e-05, Twin Peaks Veteran, Twin Peaks
5.9542477161359903e-05, A Brewing Storm, Pandaria Scenarios
5.953603186383995e-05, Draenor Curator, Archaeology
5.9400909623879793e-05, Greenstone Village, Pandaria Scenarios
5.936213519824963e-05, Direhorn in a China Shop, Pandaria
5.931265006388184e-05, Existential Crisis, Battle Raid
5.9226144135462184e-05, Hot Pocket (10 player), Raids
5.8855360095189186e-05, Vigorous VanCleef Vindicator, Cataclysm Dungeon
5.87437758779635e-05, Charged Up, Draenor
5.8268981972818724e-05, Breaking Out of Tol Barad, Cataclysm
5.81830285048122e-05, Candle in the Wind, Pandaria Raid
5.805989869816545e-05, Soaring Spirits, Twin Peaks
5.804212768210462e-05, Giant Dinosaur vs. Mega Snail, Pandaria Raid
5.7781441795010665e-05, Unga Ingoo, Pandaria Scenarios
5.761909183618434e-05, Stay Salty, Legion Dungeon
5.760886457204236e-05, Demolition Derby, Isle of Conquest
5.7592169854277806e-05, Heroic: Utgarde Keep, Lich King Dungeon
5.745495055554301e-05, The Culling of Time, Lich King Dungeon
5.7417895311502015e-05, Adventurer of Stormsong Valley, Battle for Azeroth
5.7365620283279856e-05, Infernal Ambassadors, Cataclysm
5.710108358559776e-05, Sky Walker, Legion Raid
5.699260951538924e-05, Remix to Ignition, Battle Dungeon
5.6950540720087366e-05, On The Rocks, Lich King Dungeon
5.687104448568851e-05, Killing Time, Pandaria
5.6858008971233705e-05, Ritualist Who?, Pandaria Raid
5.680967119772152e-05, I'm on a Diet, Cataclysm Dungeon
5.66788274969268e-05, Warbringer of the Horde, Rated Battleground
5.648740873695871e-05, Azeroth at War: After Lordaeron, War Effort
5.646700639482185e-05, Towers of Power, Tol Barad
5.6375584407713575e-05, Quick Cap, Warsong Gulch
5.633571314725241e-05, Notorious, Island Expeditions
5.632144705847157e-05, Buzzer Beater, Battle Raid
5.6302077378879614e-05, ...They All Fall Down, Draenor Dungeon
5.623385108561105e-05, Captain Rumsey's Lager, Cooking
5.62310088519866e-05, Naxt Victim, Legion
5.598317499539041e-05, Intro to Marine Biology, Battle Raid
5.596403561219987e-05, Respect Your Elders, Lich King Dungeon
5.593558248992062e-05, Can I Get a Hek Hek Hek Yeah?, Battle Raid
5.562890662027455e-05, Bloody Mess, Battle Raid
5.559701569178138e-05, Only the Penitent..., Cataclysm Raid
5.546308348496856e-05, Grand Master Draftsman, Draenor Garrison
5.545726966387273e-05, Lovely Luck Is On Your Side, Love is in the Air
5.5410676062842054e-05, Brewmoon Festival, Pandaria Scenarios
5.537591796704963e-05," Fire, Walk With Me", Twin Peaks
5.5219199965110064e-05, Broke Back Precipice, Draenor
5.498934029029892e-05, We're Not Retreating; We're Advancing in a Dif..., Lich King Dungeon
5.496500965667033e-05, Stag Party, Legion Dungeon
5.488697320275646e-05, Loner and a Rebel, Pandaria
5.4641264191432404e-05, Dwarfageddon (25 player), Raids
5.449327629963971e-05, Realm First! Level 80 Troll, Feats of Strength
5.437495296976428e-05, Good Grief, Lich King Dungeon
5.429556037767962e-05, Poor Unfortunate Souls, Legion Dungeon
5.427505539928147e-05, Junkyard Apprentice, Battle for Azeroth
5.4118337215010485e-05, It's Lit!, Battle Dungeon
5.406956144972556e-05, Crushing Bones and Cracking Skulls, Cataclysm Dungeon
5.4041536084501504e-05, Volunteer Work, Lich King Dungeon
5.3778860215316736e-05, Four Car Garage, Isle of Conquest
5.377362764358273e-05," Fire, Walk With Me", Twin Peaks
5.3740551955694106e-05, Clever Use of Mechanical Explosives, Battle for Azeroth
5.370523740946389e-05, Pardon Denied, Cataclysm Dungeon
5.3703824399731515e-05, Would You Like a Pamphlet?, Draenor
5.360219821732993e-05, Isle of Conquest Veteran, Isle of Conquest
5.33250235192413e-05, A Little Patience, Pandaria Scenarios
5.326735911840923e-05, Revenge is Best Served Speedily, Battle for Azeroth
5.308374034016029e-05, Sporely Alive, Battle Dungeon
5.29705448403938e-05, Wrecking Ball, Player vs. Player
5.284732998703196e-05, Watery Grave, Pandaria Scenarios
5.2624227228821394e-05, Tour of Duty: Mechagon, World
5.254707826503821e-05, Salute to Starcraft, Promotions
5.2363891530894295e-05, Stay Chill, Cataclysm Raid
5.235709848452284e-05, Four Square, Temple of Kotmogu
5.220178768978424e-05, Have a Heart, Heart of Azeroth
5.2024796856862717e-05, G.N.E.R.D. Rage, Hallow's End
5.1994493534358005e-05, What is Best in Life?, Temple of Kotmogu
5.197197910831201e-05," Once Bitten, Twice Shy (10 player)", Lich King Raid
5.17835621556287e-05, Heroic: Halls of Stone, Lich King Dungeon
5.172557186348782e-05, The Limnologist, Fishing
5.140815122902369e-05, Rare to Well Done, Battle for Azeroth
5.1141873509939915e-05, Honorary Frenzyheart, Northrend
5.104217223394529e-05, Battle on the High Seas, Pandaria Scenarios
5.102518204398362e-05, Hadronox Denied, Lich King Dungeon
5.0842329000916434e-05, Heroic: Drak'Tharon Keep, Lich King Dungeon
5.080016047297634e-05, Tower Plower, Tol Barad
5.075836495078836e-05, Glaive Grave, Isle of Conquest
5.0694723307979164e-05, Dragonmaw? More Like Dragonfall!, Draenor Dungeon
5.0495623489441544e-05, Seething Shore Domination, Seething Shore
5.049450876155457e-05, Face Clutchers, Pandaria Raid
5.023318023898879e-05, Disgracin' The Basin, Arathi Basin
5.0098870440643893e-05, Fight the Power, Draenor
4.9662387757620026e-05, Azeroth at War: The Barrens, War Effort
4.95516950589117e-05, Rotten to the Core, Cataclysm Dungeon
4.954313706899435e-05, Walk the Dinosaur, Battle Raid
4.933083865558981e-05, Eyes On The Ground, Pandaria
4.9286414617176254e-05, Northrend Angler, Fishing
4.92548592948456e-05, Be Mine!, Love is in the Air
4.924837188475662e-05, Silver in the City, Fishing
4.9228864969500224e-05, Bringing Hexy Back, Battle Dungeon
4.918591357372177e-05, Battle on the High Seas, Pandaria Scenarios
4.916934436529323e-05, Assault on Zan'vess, Pandaria Scenarios
4.8926349515074826e-05, A Void Dance, Lich King Dungeon
4.835744523673016e-05, The Fishing Diplomat, Fishing
4.8101477607167844e-05, I Love the Smell of Saronite in the Morning (1..., Raids
4.809197176225042e-05, Scrappy's Best Friend, Battle for Azeroth
4.791271207695441e-05, Chromatic Champion, Cataclysm Raid
4.740068296800661e-05, Shattered (25 player), Raids
4.730497210144058e-05, Not Even a Scratch, Player vs. Player
4.6888264402610994e-05, Everything Is Awesome!, Fishing
4.587684992652885e-05, Tragedy in Three Acts, Archaeology
4.5844760432223595e-05, Invasion? What Invasion?, Draenor Garrison
4.580313139806091e-05, Phenomenal Cosmic Power, Feats of Strength
4.577605995099445e-05, No Ticket, Draenor Dungeon
4.571409882955443e-05, Less Is More (25 player), Lich King Raid
4.568327096352159e-05, Ascendant Descending, Cataclysm Dungeon
4.5517290554144246e-05, Power Overwhelming, Pandaria Raid
4.5316387659534876e-05, Got to Ketchum All, Legion Dungeon
4.5137022066755316e-05, Infused and Abused, Legion
4.4770695019985784e-05, Ironman, Warsong Gulch
4.4516162983920195e-05, Who Needs Bloodlust? (10 player), Raids
4.4175418179148586e-05, Rapid Defense, Northrend
4.385642028751719e-05, Heroic: Azjol-Nerub, Lich King Dungeon
4.37099473997371e-05, A-VOID-ance, Draenor
4.338689128487399e-05, Recruitment Officer, War Effort
4.321097557883764e-05, Too Hot to Handle, Cataclysm Dungeon
4.25902183162977e-05, Brann Spankin' New, Lich King Dungeon
4.2583344104121155e-05, Me and the Cappin' Makin' it Happen, Arathi Basin
4.2160002167845896e-05, Resilient Victory, Arathi Basin
4.154470335745265e-05, The Traitor King (10 player), Lich King Raid
4.122916450438139e-05, Chaos Theory, Lich King Dungeon
4.1174860249855646e-05, Mine Sweeper, Northrend
4.078052287082873e-05, Gotta Go!, Lich King Dungeon
4.035040826926476e-05, Battle for Gilneas Veteran, Battle for Gilneas
4.033438155694917e-05, Who Needs Bloodlust? (25 player), Raids
4.015738104786875e-05, A Penny For Your Thoughts, Fishing
4.009528666870207e-05, Demolition Derby, Isle of Conquest
3.999668116495915e-05, Let it All Out, Legion Dungeon
3.984096746889531e-05, Rescue Operation, Ashran
3.961888326588529e-05, Dehydration, Lich King Dungeon
3.913497923595778e-05, Take From Them Everything, Draenor
3.907398917644802e-05, Let's Do Lunch: Ironforge, Cooking
3.889905705793349e-05, I'll Hold These For You Until You Get Out, Raids
3.886816232729655e-05, Double Dragon, Cataclysm Raid
3.84962296269843e-05, Full Discography, Draenor Garrison
3.820306893532178e-05, Share The Love, Lich King Dungeon
3.819879192037359e-05, Not In My House, Warsong Gulch
3.81550065688537e-05, Junkyard Architect, Battle for Azeroth
3.7551329865517266e-05, Show Me Your Moves!, Pandaria Raid
3.7519693597057085e-05, Darker Side, Legion Dungeon
3.738738848316706e-05, Mosh Pit, Pandaria Dungeon
3.738548893437328e-05, A Fish Out of Water, Battle Dungeon
3.737422904875714e-05, Master and Commander, Draenor Garrison
3.72940649925111e-05, Slagnarok, Draenor
3.7036834479560806e-05, No Tag-backs!, Draenor Dungeon
3.6850036703396664e-05, That's Not Canon!, Cataclysm Dungeon
3.659291371935248e-05, Help the Bombardier! I'm the Bombardier!, Cataclysm
3.610610602774348e-05, A Complete Circuit, Pandaria Raid
3.6054134837040856e-05, The Traitor King (25 player), Lich King Raid
3.6022777331414645e-05, Iron Wings, Draenor
3.580212127504319e-05, Tour of Duty: Stormsong Valley, World
3.575447623762596e-05, De Lurker Be'loa, Battle Raid
3.5512835042630205e-05, Silvershard Mines Veteran, Silvershard Mines
3.51410388052254e-05, The Dapper Sapper, Player vs. Player
3.496166871640343e-05, Our Powers Combined, Pandaria
3.4248458675412154e-05, One Many Army, Pandaria
3.410369328049632e-05, Cloud Nine, Twin Peaks
3.4087872126094847e-05, Many Whelps! Handle It! (25 player), Lich King Raid
3.3956322903921813e-05, Glutton for Fiery Punishment, Kalimdor
3.390581387483688e-05, Old Faithful, Cataclysm Dungeon
3.3527200383370805e-05, Take Out Those Turrets (10 player), Raids
3.34257228159006e-05, Many Whelps! Handle It! (10 player), Lich King Raid
3.2982815562686867e-05, Shattered (10 player), Raids
3.285862905390321e-05, Save Those Buildings!, Draenor Garrison
3.240708607131728e-05, Boom Bloom, Legion Dungeon
3.231805412813617e-05, I'm in the White Lodge, Twin Peaks
3.1852455817582246e-05, Tour of Duty: Drustvar, World
3.139404563984551e-05, Fish or Cut Bait: Orgrimmar, Fishing
3.092072398054361e-05, Eye of the Storm Domination, Eye of the Storm
3.0479841270348412e-05, Deepwind Gorge Veteran, Deepwind Gorge
3.0178593334424403e-05, Artillery Expert, Player vs. Player
2.9476508890551948e-05, 100 Quests Completed, Quests
2.928243388106284e-05, Watch Him Die, Lich King Dungeon
2.9064006501609965e-05, Fungal Frenzy, Cataclysm
2.8969116952957843e-05, Wintergrasp Veteran, Wintergrasp
2.870495389094863e-05, Fish or Cut Bait: Ironforge, Fishing
2.8678247149104597e-05, Quick Cap, Warsong Gulch
2.865760264509055e-05, Full Discography, Draenor Garrison
2.859033954348018e-05, It's Really Getting Out of Hand, Battle for Azeroth
2.8476990807202986e-05, What the Eck?, Lich King Dungeon
2.844036007395449e-05, Leader of Troops, War Effort
2.8406732825324084e-05, No Stone Unturned, Archaeology
2.820374013126683e-05, A Change In Scenery, Legion Raid
2.7993628813741072e-05, Head Financier of Mechagon, Battle for Azeroth
2.7986129240106694e-05, The Oceanographer, Fishing
2.795328277486421e-05, Less Is More (10 player), Lich King Raid
2.7345757569431188e-05, Better Off Dred, Lich King Dungeon
2.6984983970732104e-05, Level 120, Character
2.6877788889793335e-05, The Faceroller, Lich King Dungeon
2.6844509147245038e-05, Timeless Champion, Pandaria
2.6774800900224485e-05, Dwarfageddon (10 player), Raids
2.6756789511396817e-05, Terror of the Tadpoles, Battle for Azeroth
2.658608585210987e-05, Heroic: Gundrak, Lich King Dungeon
2.6082883847649148e-05, Draenor's Last Stand, Draenor
2.5635774388639843e-05, Straw That Broke the Camel's Back, Cataclysm Dungeon
2.535017714661155e-05, Double Rainbow, Battle for Gilneas
2.5280213982503485e-05, Acrocalypse Now, Cataclysm Dungeon
2.480955793814409e-05, Kill It With Fire!, Cataclysm Dungeon
2.4710815349840645e-05, King of Dire Maul, Classic
2.4665326263181038e-05, Back to the Depths!, Battle for Azeroth
2.4554340490279586e-05, Let's Do Lunch: Darnassus, Cooking
2.4278373476625037e-05, Temple of Kotmogu Veteran, Temple of Kotmogu
2.3451756456081754e-05, Shadow Hopper, Pandaria
2.3387740602567034e-05, Overthrow the Council, Player vs. Player
2.317724937900928e-05, Oh Novos!, Lich King Dungeon
2.3108428264812996e-05, Exploration Mission Master, Draenor Garrison
2.3081189372801953e-05, Tour of Duty: Vol'dun, World
2.301339885192556e-05, Puzzle Performer, Battle for Azeroth
2.2638758557831473e-05, Just Another Day in Tol Barad, Tol Barad
2.2631020907624042e-05, Strike!, Pandaria Raid
2.2516741963069163e-05, Bustin' Caps to Make It Haps, Battle for Gilneas
2.2433559624061725e-05, The Harder they Fall, Archaeology
2.2420551253069632e-05, Adventurer of Vol'dun, Battle for Azeroth
2.2212791322079027e-05, Zombiefest!, Lich King Dungeon
2.210839630710192e-05, Fast and Furious, Character
2.209776613752312e-05, That Was Entirely Unnecessary, Draenor
2.2076628293438662e-05, A Steamy Romance Saga, Legion Dungeon
2.1977469098659893e-05, Rubble and Roll (10 player), Raids
2.189955376082966e-05, Not In My House, Warsong Gulch
2.1729183566264563e-05, Other People's Property, Battlegrounds
2.1462549055141124e-05, Wrath of the Alliance, Player vs. Player
2.1442774281702453e-05, Level 10, Character
2.119465314463173e-05, Supermassive (10 player), Raids
2.102743071461505e-05, Blue Streak, Archaeology
2.0960745024114547e-05, Level 110, Character
2.0925158813578072e-05, Rubble and Roll (25 player), Raids
2.087358053659444e-05, Level 100, Character
2.082752146096489e-05, A Frosty Shake, Winter Veil
