importance,name,category
0.00029564453163678745, Realm First! Level 80 Paladin, Feats of Strength
0.00029564286927577575, Three Lights in the Darkness, Lich King Raid
0.00029529138895944895, Adventurer of Argus, Legion
0.00029520422060489934, Ahead of the Curve: Queen Azshara, Raids
0.00029508088192098706, Mythic: Return to Karazhan, Legion Dungeon
0.00029498869192337096, Mythic: Conclave of the Chosen, Battle Raid
0.0002948353720347245, Order of Embers, Battle for Azeroth
0.0002948313845238761, Darkmoon Racer Jockey, Darkmoon Faire
0.0002945230925132115, Surge Protector, Legion Dungeon
0.00029451677001222313, Elite: Battle for Azeroth Season 1, Player vs. Player
0.0002944808417428208, Strand of the Ancients Veteran, Player vs. Player
0.00029427980020139407, Dominant Combatant, Player vs. Player
0.00029424254546413844, Protocol 2.3, Player vs. Player
0.000294187363720912, Champion of the Naaru, Raids
0.00029416715346746125, Explore Talador, Draenor
0.0002941210586727183, Tempest Keep, The Burning Crusade
0.0002940923834901249, Red Rider Air Rifle, Events
0.0002939188519079986, Ahead of the Curve: Argus the Unmaker, Raids
0.00029382440761966023, Decade of Dominance, Player vs. Player
0.00029367964514680645, Primal Conquest, Player vs. Player
0.00029355183625072423, Lodi Dodi We Loves the Skadi, Lich King Dungeon
0.0002934997255542623, Mistwalker, Dungeons
0.000293387790325302, Explore Hyjal, Cataclysm
0.00029338535547554197, The Orb Whisperer (25 player), Lich King Raid
0.00029334454155102317, Defense of Dazar'alor, Battle Raid
0.0002933304388150176, You Are Not Your $#*@! Legplates (Season 3), Legacy
0.00029329798003366195, Mythic: Il'gynoth, Legion Raid
0.00029315037849273953, Siege of Wyrmrest Temple, Cataclysm Raid
0.0002931165176303458, Sunken Ambitions, Battle for Azeroth
0.0002930922931608824, Explore Thousand Needles, Kalimdor
0.00029305369568581504, Realm First! Level 85 Shaman, Feats of Strength
0.0002930171015431073, Mythic: Vault of the Wardens, Legion Dungeon
0.0002929948706100039, Darkmoon Dungeoneer, Darkmoon Faire
0.00029265322918656977, Heroic: Bloodmaul Slag Mines, Draenor Dungeon
0.00029259693561402517, Mythic: Dragons of Nightmare, Legion Raid
0.00029244533441285874, Sha'tari Defense, Draenor
0.0002924193745385762, Can't Do That While Stunned, Lich King Raid
0.00029238198389235396, Heroic: Shadowmoon Burial Grounds, Draenor Dungeon
0.00029224019246093535, Royal Athenaeum, Legion Raid
0.0002922236090171565," Not One, But Two Jormungars (25 player)", Lich King Raid
0.0002921003257279833, Big Powermonger: Silver, Darkmoon Faire
0.00029206089487401," Lock, Stock and Two Smoking Goblins", Legion
0.00029202008135216484, Going On Seventeen, Player vs. Player
0.00029198687575572585, Clockwork Rocket Bot, Events
0.0002917978679163143, Duskwood Quests, Eastern Kingdoms
0.000291791283956026, She Deep Breaths More (25 player), Lich King Raid
0.00029174810363443923, I'm on a Boat (25 player), Lich King Raid
0.0002916017015205117, Fierce Combatant, Player vs. Player
0.00029158702505683204, Nazjatarget Eliminated, Battle for Azeroth
0.00029158222835539425, Mythic: Kormrok, Draenor Raid
0.00029151224589658614, The Dwarven Dream, Archaeology
0.0002914343551951104, Within Our Grasp, Wintergrasp
0.00029138015674237856, Green Acres, Pandaria
0.00029129840702536947, Sapphiron's Demise (25 player), Lich King Raid
0.0002908395396401379, Heroic: Seat of the Triumvirate, Legion Dungeon
0.00029082865111349854, Knock on Wood, Lich King Raid
0.0002906410066050085, Heroic: Upper Blackrock Spire, Draenor Dungeon
0.0002905771737175542, Heroic: Storming the Citadel (25 player), Lich King Raid
0.000290524978040023, Mythic: Fel Lord Zakuun, Draenor Raid
0.0002904689295373851, High Five: 1750, Player vs. Player
0.00029045424981592445, Now You're Thinking With Portals, Legion
0.0002902072094024355, Helheim Hath No Fury, Legion Dungeon
0.0002901983236893116, Mythic: Kromog, Draenor Raid
0.00029019732441857855, Cutting Edge: Argus the Unmaker, Raids
0.00029016429084099515, Mythic: Imonar the Soulhunter, Legion Raid
0.0002898079334092561, Mythic: Elerethe Renferal, Legion Raid
0.00028967597631203906, Lieutenant General, Rated Battleground
0.00028966477734085886, Realm First! Battle for Azeroth Keystone Master, Feats of Strength
0.00028956415917660486, Mythic: Demonic Inquisition, Legion Raid
0.0002894135347547968, Take Command, Legion
0.00028939238996163527, The Legion Will NOT Conquer All, Draenor Raid
0.000289313409878808, Realm First! Level 85, Feats of Strength
0.00028915371817893435, Journeyman Cook, Cooking
0.00028911282805656294, Pandaren Ambassador, Pandaria
0.00028902217167098824, Frostfire Fridge, Draenor
0.00028900355951811703, Mythic: Blackwater Behemoth, Battle Raid
0.00028893849307229304, Realm First! Level 90 Warlock, Feats of Strength
0.0002888835031727224, Heroic: Warlord Zon'ozz, Cataclysm Raid
0.0002888641218172346, Master Archaeologist, Archaeology
0.00028848539758040653, Competitor's Tabard, Events
0.00028848089363259964," 25,000 Conquest Points", Currencies
0.0002884330315100548, Nemesis: Killer of Kezan, Draenor Garrison
0.00028842779368145417, Realm First! Level 85 Hunter, Feats of Strength
0.0002884235489456853, The Construct Quarter (25 player), Lich King Raid
0.00028842102132971113, What a Ripoff!, Legion
0.0002881995095865568, Heroic: Well of Eternity, Cataclysm Dungeon
0.00028814695549163224, Share the Pain, Cataclysm Raid
0.0002881313330544477, Vindictive Combatant, Player vs. Player
0.0002881020057807616, Mythic: Ra-den the Despoiled, Battle Raid
0.0002880428669080259, Dances with Oozes (25 player), Lich King Raid
0.0002879987957430461, Cage Match, Pandaria Raid
0.00028788904677772015, Cooking Award, Cooking
0.0002878319334757177, Zandalar Forever!, Battle for Azeroth
0.0002877623836142563, Mythic: Cenarius, Legion Raid
0.0002876475378109055, Bomberman, Pandaria Dungeon
0.00028749447298087214, Mythic: The Queen's Court, Battle Raid
0.00028743855004705597, Movin' On Up, Draenor Garrison
0.00028735318424517615, Mythic: Iron Reaver, Draenor Raid
0.0002872888969687921, Mythic: Eonar, Legion Raid
0.0002869756975127114, Heroic: Sinestra, Cataclysm Raid
0.00028684518420321186, A Bargain of Blood, Battle for Azeroth
0.0002866728374773198, Boned (10 player), Lich King Raid
0.0002866609905841933, Heroic: Ragnaros, Cataclysm Raid
0.00028661108579215966, Elite: Battle for Azeroth Season 2, Player vs. Player
0.0002864570822592917, Mythic: Nythendra, Legion Raid
0.00028633374618540464, Challenge Master: Skyreach, Dungeons
0.00028613096956850225, Mythic: Crestfall, Island Expeditions
0.00028606939551870385, Nearly Indestructible, Draenor Raid
0.0002860030071739393, Save the Day, Warsong Gulch
0.000285704712440174, Treasure Mission Specialist, Draenor Garrison
0.00028557570154460023, Rocketeer: Bronze, Darkmoon Faire
0.00028554730584214044, Heroic: Magmaw, Cataclysm Raid
0.00028544330841740373, Eighteen and Over, Player vs. Player
0.00028533908725413877, Mythic: Iron Maidens, Draenor Raid
0.000285206047396052, 5 Coins of Ancestry, Lunar Festival
0.0002851469710824391, Shatter Resistant, Lich King Dungeon
0.0002850518137572414, Explore Val'sharah, Legion
0.0002850250586363862, Zandalari Fisherman, Fishing
0.00028501715841027, Classic Cook, Cooking
0.000284909620920168, Alizabal, Tol Barad
0.00028485897025894657, Floor Thirteen, Player vs. Player
0.00028475068845051167, These Go To Eleven, Player vs. Player
0.0002847260291417691, Mythic: Kilrogg Deadeye, Draenor Raid
0.0002846714010491575, If It Pleases the Court, Battle Raid
0.0002846678956781358, Realm First! Zen Master Archaeologist, Feats of Strength
0.00028449325128514566, Darkmoon Racer Novice, Darkmoon Faire
0.00028441954243983654, Stamp Stamp Revolution, Draenor Raid
0.0002841809943669213, Mythic: Kargath Bladefist, Draenor Raid
0.00028416845702122334, Heroic: Yor'sahj the Unsleeping, Cataclysm Raid
0.00028405141763941454, Realm First! Level 90 Rogue, Feats of Strength
0.00028400022253850164, Tides of Vengeance, Battle for Azeroth
0.00028397560306865356, Realm First! Level 80, Feats of Strength
0.00028392942762568653, Heroic: The Forge of Souls, Lich King Dungeon
0.0002839177637622763, Ahead of the Curve: Xavius, Raids
0.00028388032974247787, WoW's 8th Anniversary, Events
0.0002838228920496452, The Circle of Stars, Battle Raid
0.0002835869772374869," Not One, But Two Jormungars (10 player)", Lich King Raid
0.00028350714204581506, Making the Mount, Battle for Azeroth
0.0002834637137161623, Mythic: Jorundall, Island Expeditions
0.00028339198408194264, Arak Star, Draenor
0.0002833912325978258, 1000 Fish, Fishing
0.00028335119814246315, 100 Stone Keeper's Shards, Currencies
0.00028329277853322865, Cruel Combatant, Player vs. Player
0.0002832233218581203, Seasoned: Hunter Akana, Battle for Azeroth
0.00028315072912538623, Mythic: Cathedral of Eternal Night, Legion Dungeon
0.00028309922641173884, Shadowmourne, Raids
0.0002829670339862827, Demonic Combatant, Player vs. Player
0.0002829035009012092, Warmongering Gladiator's Felblood Gronnling, Mounts
0.000282873112060515, Mythic: The Desolate Host, Legion Raid
0.0002827925467246181, Knight, Rated Battleground
0.0002827060843945616, Heroic: The Plagueworks (25 player), Lich King Raid
0.00028270261953235805, Set Sail!, Draenor Garrison
0.00028247437671938947, Redridge Mountains Quests, Eastern Kingdoms
0.00028244675969672653," 50,000 Conquest Points", Currencies
0.0002824261376470956, Knight-Captain, Rated Battleground
0.00028219221832460407, Like an Arrow to the Face, Pandaria Raid
0.0002821889500278652, The Arachnid Quarter (10 player), Lich King Raid
0.0002820143544995359, Round Three. Fight!, Cataclysm
0.0002820010471828239, Realm First! Illustrious Leatherworker, Feats of Strength
0.00028195963591582876, Big Rocketeer: Silver, Darkmoon Faire
0.0002819558235477181, Mythic: Chronomatic Anomaly, Legion Raid
0.0002819537195461443, Upper Back Pain (25 player), Lich King Raid
0.0002819313002910661," Grand Theft, 1st Degree", Ashran
0.0002818261928284457, Destructor's Rise, Draenor Raid
0.0002817980076501892, Mythic: Zek'voz, Battle Raid
0.00028177598814608704, Mythic: G'huun, Battle Raid
0.00028175829019307596, Mythic: Lady Ashvane, Battle Raid
0.0002816309542525517, Mythic: Gruul, Draenor Raid
0.00028141552829409687, Realm First! Level 90 Monk, Feats of Strength
0.00028133800714162145, Old Ironjaw, Fishing
0.0002813043374421405, Hot Pocket, Lich King Raid
0.000281279122024425, The Gates of Hell, Legion Raid
0.00028127508189637195, Don't Get Cocky Kid, Battle for Gilneas
0.0002812749927934336, Heroic: Ultraxion, Cataclysm Raid
0.00028119171816621435, Wild Combatant, Player vs. Player
0.00028114875491619184, Flying High, Darkmoon Faire
0.0002810474388736785, Fearless Elite, Player vs. Player
0.0002809866211975386, Ruthless Gladiator, Player vs. Player
0.00028097787516913244, Glintrok N' Roll, Pandaria Dungeon
0.0002809517933872828, Heroic: Hagara the Stormbinder, Cataclysm Raid
0.0002809214318663697, Just for Me, Ashran
0.0002809151735510761, Realm First! Level 85 Death Knight, Feats of Strength
0.00028088680619667994, Grand Marshal, Rated Battleground
0.0002807817096055124, Gladiator: Battle for Azeroth Season 3, Player vs. Player
0.0002805792995890757," Atiesh, Greatstaff of the Guardian", Raids
0.00028054919351952934, It's an Invasion!, Draenor Garrison
0.0002805304650830164, Kiss and Make Up, Lich King Raid
0.00028050391912129544, Realm First! Level 80 Hunter, Feats of Strength
0.0002804290065491527, Explore Burning Steppes, Eastern Kingdoms
0.0002803519713199877, Seasoned: Bladesman Inowari, Battle for Azeroth
0.00028001984044505904, Hounds Good To Me, Legion Raid
0.0002800111843774845, Is There a Medic in the Zone?, Professions
0.0002799125563642191, Big Powermonger: Bronze, Darkmoon Faire
0.0002797890836726896, Legion Aquaculture, Fishing
0.0002796808341646202, High Five: 1550, Player vs. Player
0.00027967232210663413, In Service of the Alliance, Rated Battleground
0.00027967109006908386, Challenge Master: Auchindoun, Dungeons
0.0002795100131230349, Mythic: The Coven of Shivarra, Legion Raid
0.0002794005826677586, Notorious Gladiator's Proto-Drake, Mounts
0.00027917221346352025, Double Decade of Dominance, Player vs. Player
0.0002790838151493474, Cruel Combatant, Player vs. Player
0.0002790762846048868, Emalon the Storm Watcher (25 player), Wintergrasp
0.00027900437490052074, Heroic: Grimrail Depot, Draenor Dungeon
0.00027892474141699177, Explore Townlong Steppes, Pandaria
0.00027891103709126486, End of the Line, Silvershard Mines
0.0002789082275390853, Educated Guesser, Brawler's Guild
0.00027854353161416764, Mythic: Spellblade Aluriel, Legion Raid
0.0002783750622814987, Death from Above, Cataclysm Raid
0.00027820782198952586, Big Wanderluster: Bronze, Darkmoon Faire
0.0002782016886676959, On the Shadow's Trail, Draenor
0.00027813858115558637, Heroic: Skyreach, Draenor Dungeon
0.0002781371018988978, Outland Cook, Cooking
0.0002780733321809342, Heroic: Zul'Aman, Cataclysm Dungeon
0.000277934769481647, Mythic: Flamebender Ka'graz, Draenor Raid
0.00027790019402824424, The Last of Us, Player vs. Player
0.0002778396609145199, Explore Darkshore, Kalimdor
0.00027782430544520643, Ready for Raiding V, Legion Dungeon
0.00027773214268969734, Vengefully Dedicated, Arena
0.0002777320602987674, Realm First! Pandaren Ambassador, Feats of Strength
0.0002777245073908839, Mythic: Un'gol Ruins, Island Expeditions
0.000277627605959843, Mythic: Imperator's Fall, Draenor Raid
0.00027761095575128624, If Looks Could Kill, Lich King Raid
0.0002776025772759843, Explore Tanaris, Kalimdor
0.0002775406138873768, Challenge Master: Grimrail Depot, Dungeons
0.0002774223701120958, Rocket Man, Darkmoon Faire
0.0002773789561327549, Mythic: Xhul'horac, Draenor Raid
0.0002773265471757915, Mythic: Snowblossom Village, Island Expeditions
0.00027708767991123937, Seasoned: Neri Sharpfin, Battle for Azeroth
0.00027706634039219964, Challenge Master: Bloodmaul Slag Mines, Dungeons
0.0002770183989977744, Big Race Novice, Darkmoon Faire
0.00027701219147100955, Challenge Master: Gate of the Setting Sun, Dungeons
0.00027685915867945083, Alone in the Darkness (25 player), Raids
0.0002767813666388404, Explore Western Plaguelands, Eastern Kingdoms
0.00027677129095128963, Mythic: High Botanist Tel'arn, Legion Raid
0.0002765649820493222, Mythic: Guarm, Legion Raid
0.00027650382774165863, Realm First! Illustrious Blacksmith, Feats of Strength
0.00027647106971613063, Artisan Archaeologist, Archaeology
0.0002764680054371798, Heroic: Beth'tilac, Cataclysm Raid
0.0002764397240328359, Explore Redridge Mountains, Eastern Kingdoms
0.00027637603378940096, Big Rocketeer: Bronze, Darkmoon Faire
0.0002761763128506086, Challenge Master: Temple of the Jade Serpent, Dungeons
0.00027606602451164905, Keeping It Rare, Draenor Garrison
0.00027602792200511194, WoW's 9th Anniversary, Events
0.0002757849140760642, Lower Blackrock Spire, Classic
0.0002757729136255979, Heroic: Mana-Tombs, The Burning Crusade
0.0002756573246465048, A Magic Contribution, Legion
0.0002755983239098972, Champion of the Vulpera, Battle for Azeroth
0.0002754423456796019, Wayfarer, Darkmoon Faire
0.00027536059270469895, Draenor Cook, Cooking
0.0002750895458076251, Mythic: Twin Ogron, Draenor Raid
0.00027508832569389665, Ahead of the Curve: Sha of Fear, Raids
0.0002750283361096189, Chapter II: Gul'dan Strikes Back, Legacy
0.0002748057555325727, Gruul's Lair, The Burning Crusade
0.0002747572811072767, Journeyman Fisherman, Fishing
0.00027460883701751126, Challenge Master: Scholomance, Dungeons
0.0002745361984039889, Mythic: Shadowmoon Burial Grounds, Draenor Dungeon
0.0002744353367931468, Wild Conquest, Player vs. Player
0.0002742417652167575, Explore Frostfire Ridge, Draenor
0.00027411533124297854, The Reining Champion, Battle for Azeroth
0.0002740705105794881, Timely Death, Lich King Dungeon
0.00027403475242388875, Champion, Player vs. Player
0.00027402544879764527, Explore Searing Gorge, Eastern Kingdoms
0.0002739904610568955, Working More Orders, Draenor Garrison
0.00027395222630974606, Fierce Elite, Player vs. Player
0.00027388987615822847, Big Wanderluster: Silver, Darkmoon Faire
0.00027386523628466136, Botani Invasion, Draenor Garrison
0.0002736593783307143, Heroic: Halfus Wyrmbreaker, Cataclysm Raid
0.0002736357610293289, Mythic: Jadefire Masters, Battle Raid
0.0002735998395012403, Grievous Conquest, Player vs. Player
0.00027359645866706714, Veteran of the Wrathgate, Northrend
0.00027353492795843674, The Total Package, Legion
0.00027337412366292257, Mythic: Hellfire Assault, Draenor Raid
0.00027324417912938804, With a Nagrand Cherry On Top, Draenor
0.0002730726473445909, Deck Your Collection (Season 2), Legacy
0.0002729698795586727, Karazhan, The Burning Crusade
0.0002729080439955513, Mythic: Gorefiend, Draenor Raid
0.000272797671488687, Prideful Combatant, Player vs. Player
0.00027266746611435163, The Prestige, Legion Class Hall
0.00027256995513874453, Lieutenant Commander, Rated Battleground
0.0002725210476307255, Realm First! Level 80 Mage, Feats of Strength
0.00027247361969773726, Do a Barrel Roll!, Cataclysm Raid
0.00027242214270034137, Champion, Rated Battleground
0.0002723408483191029, Mythic: Fetid Devourer, Battle Raid
0.00027232657297990607, Big Race Jockey, Darkmoon Faire
0.0002720231697777584, 10 Coins of Ancestry, Lunar Festival
0.00027195767961190183, Heroic: Madness of Deathwing, Cataclysm Raid
0.00027188996546848184, Heroic: Gara'jal the Spiritbinder, Pandaria Raid
0.0002718838025141067, Field Medic, Professions
0.0002717411763997477, You Are Not Your $#*@! Legplates, Brawler's Guild
0.00027155673680766214, On a Massive Number of Missions, Draenor Garrison
0.00027154130294818296, Magtheridon's Lair, The Burning Crusade
0.0002714829075869256, Mythic: Socrethar the Eternal, Draenor Raid
0.0002714292100696958, Savior of Stoneplow, Pandaria
0.00027141166847625807, Mythic: Skittering Hollow, Island Expeditions
0.0002713954252948841, Alive for Five, Player vs. Player
0.00027126681780306977, Portal Jockey (25 player), Lich King Raid
0.00027100502552245454, Insane in the Membrane, Reputation
0.00027098424691849026, Heroic: Shannox, Cataclysm Raid
0.0002708401077392917, Realm First! Level 90 Death Knight, Feats of Strength
0.0002705634142537257, Mythic: Tyrant Velhari, Draenor Raid
0.00027049964412686583, Marshal, Rated Battleground
0.00027037904303054935, Fortune of Pandaria, Pandaria
0.0002703757225608769, Brutal Nether Drake, Mounts
0.00027033681790311864, Sunwell Plateau, The Burning Crusade
0.00027016330049623924, Subtraction (25 player), Lich King Raid
0.0002700422655101647, Don't Need to Break Eggs to Make an Omelet, Cataclysm Dungeon
0.00027002153774538523, Collect Your Deck (Season 2), Legacy
0.00026998473724247933, Mythic: Shadow-Lord Iskar, Draenor Raid
0.0002698571601253925, The Horde Slayer, Player vs. Player
0.0002698463067441193, Salt and Pepper (25 player), Lich King Raid
0.00026979582082323585, Heroic: Blackrock Caverns, Cataclysm Dungeon
0.00026978037040201414, Explore Dragonblight, Northrend
0.0002697096406047016, Explore Sholazar Basin, Northrend
0.00026955138822326623, Heroic: Utgarde Pinnacle, Lich King Dungeon
0.0002694462472915362, Mythic: Krosus, Legion Raid
0.0002694179791268259, Resourceful, Professions
0.00026940813640661734, Storming the Citadel (25 player), Lich King Raid
0.000269239470493499, Mythic: The Hivemind, Battle Raid
0.0002691511923530659, Angling for Battle, Fishing
0.00026911114492962954, Realm First! Level 90 Hunter, Feats of Strength
0.00026907015952822786, Explore Highmountain, Legion
0.00026904795176710384, Unbroken, Lich King Raid
0.00026901677986387754, Be Quick or Be Dead, Draenor Raid
0.0002689072285577476, Ashran Victory, Ashran
0.0002688933971698598, Primal Combatant, Player vs. Player
0.00026880359400933274, Minutes to Midnight, Cataclysm Raid
0.00026871181754278714, Sergeant, Rated Battleground
0.00026831940732942127, Challenge Master: Siege of Niuzao Temple, Dungeons
0.00026827366467558966, Explore the Cape of Stranglethorn, Eastern Kingdoms
0.0002680182145219008, Siffed (25 player), Raids
0.0002679966679652571, Denyin' the Scion (25 player), Lich King Raid
0.0002679243550630924, Hero of the Horde, Rated Battleground
0.0002678215066424161, Explore The Hinterlands, Eastern Kingdoms
0.0002677506989980741, Mythic: Queen Azshara, Battle Raid
0.0002677206800892804, Zandalari Archaeologist, Archaeology
0.0002676810656764573, Cutting Edge: N'Zoth the Corruptor, Raids
0.00026755855101387417, Brawler for Azeroth, Brawler's Guild
0.00026752544545868525, Explore Duskwood, Eastern Kingdoms
0.000267506003148231, Explore Silverpine Forest, Eastern Kingdoms
0.0002674847238654317, Heroic: Valiona and Theralion, Cataclysm Raid
0.00026736365768738357, Mythic: Za'qul, Battle Raid
0.00026734718030465464, Heroic: Nefarian, Cataclysm Raid
0.00026724973216602773, The Plagueworks (25 player), Lich King Raid
0.00026714540641671034, General, Rated Battleground
0.0002671209005331032, Realm First! Level 80 Shaman, Feats of Strength
0.0002670743409866498, Upper Back Pain (10 player), Lich King Raid
0.000267023934400008, My Item Level Is Way Higher than Yours, Draenor Garrison
0.00026696392372106985, Vindictive Combatant, Player vs. Player
0.0002668377356944746, Pushing the Payload, Battle for Azeroth
0.00026682334673532927, Demonic Gladiator's Storm Dragon, Mounts
0.0002668230273762166, Furious Gladiator's Frost Wyrm, Mounts
0.0002668005783793929, Mythic: Drest'agath, Battle Raid
0.00026678975070572065, Wild Gladiator's Felblood Gronnling, Mounts
0.0002667439643822907, Heroic: Deadmines, Cataclysm Dungeon
0.0002667159863842922, Destruction Derby, Wintergrasp
0.0002665239863696215, Mythic: Skyreach, Draenor Dungeon
0.00026642081998887694, Champion of Sen'jin, Argent Tournament
0.00026623617808501987, Mythic: Brackenspore, Draenor Raid
0.00026621295315816794, Freedom of the Horde, Player vs. Player
0.0002662072852562773, Sergeant, Rated Battleground
0.0002662016626595695, Heroic: The Nexus, Lich King Dungeon
0.00026612616462881795, Call of the Crusade (25 player), Lich King Raid
0.00026582135274428513, Baiting the Enemy, Fishing
0.0002658075012385655, Mythic: Trilliax, Legion Raid
0.00026572386522870866, Realm First! Level 80 Druid, Feats of Strength
0.0002656906013438903, Onyxia's Lair (25 player), Lich King Raid
0.00026565473305778276, Tormented Guardians, Legion Raid
0.00026550364358292696, Vagabond, Darkmoon Faire
0.0002654183418837698, Grievous Conquest, Player vs. Player
0.0002654113065852301, Vicious Gladiator's Twilight Drake, Mounts
0.00026531892615668006, Heroic: The Crimson Hall (25 player), Lich King Raid
0.00026522312935454664, Gaudy Winter Veil Sweater, Events
0.00026511125267510133, Three's Company: 2700, Arena
0.0002650697350127823, Blast Off!, Darkmoon Faire
0.00026498691616617015, Naval Siege Expert, Draenor Garrison
0.0002649114114889678, Defender of Azeroth: Legion Invasions, Events
0.0002648544261849713, This Land Was Green and Good Until..., Draenor Raid
0.00026466838040291107, Realm First! Magic Seeker, Feats of Strength
0.00026449621661521044, You Are Not Your $#*@! Legplates, Brawler's Guild
0.0002643503189787428, Brutally Dedicated, Arena
0.00026430206423206184, I'm on a Boat (10 player), Lich King Raid
0.0002642259270546509, Gates of Retribution, Pandaria Raid
0.00026418256476707383, A Nation United, Battle for Azeroth
0.00026407776490903594, Fourteen for the Team, Player vs. Player
0.00026380056391307006, Corrupted Gladiator's Proto-Drake, Mounts
0.00026377253400006683, Twenty-One Arms Salute, Player vs. Player
0.0002637338705683943, Hatchling of the Talon, Legion
0.0002632965683308039," Don't Hate, Grind to Eight", Player vs. Player
0.0002632457082687284, Heroic: Al'Akir, Cataclysm Raid
0.0002631273827489187, In Service of the Horde, Rated Battleground
0.00026311393691879, Realm First! Level 90 Paladin, Feats of Strength
0.0002629924773023798," Val'anyr, Hammer of Ancient Kings", Raids
0.0002629335647324326," Grand Theft, 2nd Degree", Ashran
0.0002627209732821676, Rocketeer: Silver, Darkmoon Faire
0.00026252264763399787, The Walled City, Draenor Raid
0.0002625166985166035, Realm First! Level 80 Blood Elf, Feats of Strength
0.000262259234643332, Hand of A'dal, Raids
0.0002622435771159553, Heroic: Shadowfang Keep, Cataclysm Dungeon
0.00026219594846619133, Heroic: The Slave Pens, The Burning Crusade
0.0002621955618998641, Ahead of the Curve: Gul'dan, Raids
0.0002620139663680451, Heroic: Atramedes, Cataclysm Raid
0.00026195522522908085, Scout, Rated Battleground
0.0002618523606504519, Heroic: Magister's Terrace, The Burning Crusade
0.0002618322782501658, Rolo's Riddle, Pandaria
0.00026180985711146205, Frontline Warrior, Battle for Azeroth
0.00026180982030453404, Zandalari Cook, Cooking
0.00026175635501094087, Senior Sergeant, Rated Battleground
0.0002617028417379081, Staying Buffed All Winter, Lich King Raid
0.0002614532438602144, Commander, Player vs. Player
0.00026142511117727916, Spirits Be With You, Battle for Azeroth
0.00026141771989677474, Zen Master Fisherman, Fishing
0.0002612026697031438, Remember the Titans, Legion Raid
0.0002611564408707571, Ring of the Kirin Tor, Collections
0.00026112239328318203, Throne of the Four Winds, Cataclysm Raid
0.00026102956811251224, The Frostwing Halls (25 player), Lich King Raid
0.000261025410812579, Primal Conquest, Player vs. Player
0.0002609996003518475, Fall of Deathwing, Cataclysm Raid
0.0002608141683095325, Heroic: Scarlet Halls, Pandaria Dungeon
0.0002607288112225145, Nemesis: Worgen Hunter, Draenor Garrison
0.0002605620708004898, Firelands, Cataclysm Raid
0.0002604234678853787, Resilience Will Fix It (10 player), Lich King Raid
0.0002603949045986685, Legionnaire, Rated Battleground
0.00026018489117794297," Knock, Knock on Wood", Lich King Raid
0.00026006152944404336, When You're Fifteen, Player vs. Player
0.0002600354337081343, Prideful Combatant, Player vs. Player
