importance,name,category
0.00022706442599056346, Downfall, Pandaria Raid
0.0002270476994941828, Dine and Bash, Legion Dungeon
0.000226937286562967," Hey, You're a Rockstar!", Darkmoon Faire
0.00022678734929999466, Pushing the Payload, Battle for Azeroth
0.00022650446332417014, Subaquatic Support, Battle for Azeroth
0.00022647779427563348, Naval Armada, Draenor Garrison
0.00022644875042532453, Vampire Hunter, Events
0.00022644785871704054, Ahead of the Curve: Grand Empress Shek'zeer, Raids
0.00022615798442517627, Realm First! Grand Master Leatherworker, Feats of Strength
0.00022613602071152897, Spirit of Competition, Events
0.00022607347445824307, Yaungolian Barbecue, Pandaria Scenarios
0.00022604587606559585, Heroic: Four Kings, Pandaria Raid
0.00022587087431083806, Chapter III: The Foundry Falls, Legacy
0.00022581793652079772, Goodness Gracious, Draenor
0.00022581381191019145, Ten Hit Tunes, Draenor Garrison
0.00022567196777563013, Master of the Pot, Cooking
0.00022565736055555637, Lasers and Magnets and Drills! Oh My!, Pandaria Raid
0.0002256388932868325, Now You're Just Showing Off (Season 2), Legacy
0.00022555610936316132," Make Love, Not Warcraft", Player vs. Player
0.0002254271711955461, Genetically Unmodified Organism, Pandaria Raid
0.00022528986671732626, Shattered, Lich King Raid
0.00022524625279768412, Staying Buffed All Winter (10 player), Raids
0.00022513730157760304, Storm the Beach, Player vs. Player
0.0002251161721041, Disarmed (10 player), Raids
0.00022509924773334123, Item Level Force, Draenor Garrison
0.00022509920939853368, Ohganot So Fast!, Cataclysm Dungeon
0.0002250883209971899, Heroic: Scholomance, Pandaria Dungeon
0.00022503027093707467, More Dots! (25 player), Lich King Raid
0.00022493244371030445, 10 Cooking Awards, Cooking
0.0002248245325895596, Scholomance: Gold, Dungeons
0.0002247604302559376, Veteran: Bladesman Inowari, Battle for Azeroth
0.00022470936423965606, I'm Your Number One Fan (Season 2), Legacy
0.0002246519839335969, Don't Fear the Reaper, Draenor Raid
0.00022456831481114132, Getting Hot In Here, Pandaria Raid
0.00022449300429708692, As I Walk Through the Valley of the Shadow of ..., Draenor
0.00022424598502867254, Illustrious Grand Master Archaeologist, Archaeology
0.0002242268563846807, Challenge Master: Shadowmoon Burial Grounds, Dungeons
0.00022417097949256097, Shado-Pan Monastery: Gold, Dungeons
0.0002241635296328571, Slugfest, World
0.00022411260148553762, Explore Grizzly Hills, Northrend
0.0002239021383575378, Ahead of the Curve: Lei Shen, Raids
0.0002239004290985338, Gurubashi Arena Master, Player vs. Player
0.00022383868457798685, The Second Rule of Brawler's Guild (Season 2), Legacy
0.00022374306526996385, Perfect Delivery, Pandaria Scenarios
0.00022371473818622137, Vientos!, World Events
0.00022367711487030712, Grievous Combatant, Player vs. Player
0.00022362778346699102, Surveying the Land, Archaeology
0.0002234349378365328, Realm First! Illustrious Scribe, Feats of Strength
0.00022341702291193185, Pilgrimage, Pandaria
0.00022340270191132067," They Burn, Burn, Burn", Draenor Dungeon
0.00022335334252743803, Mythic: Tectus, Draenor Raid
0.00022317374957414357, Season Tickets, Legion Dungeon
0.00022283016496480476, Dominant Gladiator's Storm Dragon, Mounts
0.00022280531369617146, We Had It All Along *cough*, Arathi Basin
0.00022278126854687622, Explore Southern Barrens, Kalimdor
0.0002226569884413578, Temple of the Jade Serpent: Gold, Dungeons
0.00022261938234063093, Explore Northern Stranglethorn, Eastern Kingdoms
0.00022259398838043738, Essence Overload, Heart of Azeroth
0.00022247198031474867, Tabard of the Protector, Events
0.00022245944998046393, Time is a Flat Circle, Raids
0.00022244095521639008, Third Time's the Charm, Player vs. Player
0.00022241720683365763, Searing Gorge Quests, Eastern Kingdoms
0.000222399345680466, Siffed (10 player), Raids
0.00022234586211241383, Flame Keeper of Draenor, Midsummer
0.00022231223019327938, Fearless Leader, Draenor Garrison
0.00022223280321003486, Defender of the Broken Isles, Legion
0.00022210492400658626," Mythic: Uu'nat, Harbinger of the Void", Battle Raid
0.0002220974992703718, MiniZep Controller, Events
0.0002220939679390986, I Smell A Giant Rat, Fishing
0.00022194355681790664, Pay to Slay, Pandaria
0.00022191392410159103, Ahead of the Curve: The Black Gate, Raids
0.0002218732799115941,"Series([], )","Series([], )"
0.0002218331303428981, Love Magnet, Love is in the Air
0.00022180130178352573, A Test of Valor, Legacy
0.00022179737608503202, Blood Guard, Player vs. Player
0.0002217104619429765, Westfall Quests, Eastern Kingdoms
0.00022170412401173106, Vicious Gladiator, Player vs. Player
0.00022089385689136743, Zen Master Cook, Cooking
0.00022088896590009027, Gluten Free, Legion Raid
0.00022085788387264386, Explore Gorgrond, Draenor
0.00022078339013422926, Band of Brothers, World
0.000220693234885481, Dances with Oozes (10 player), Lich King Raid
0.0002206012779080813, Monomania, Draenor Dungeon
0.00022056359102207715, Emalon the Storm Watcher (10 player), Wintergrasp
0.00022054514924688844, Extinguishing Zandalar, Midsummer
0.00022053377794103234, Frontline Veteran, World
0.00022046456479440674, Dropping Some Eaves, Legion Dungeon
0.00022044795859527477, Heroic: The Crimson Hall (10 player), Lich King Raid
0.00022041813711245944, Brawlin' and Shot Callin' (Season 1), Legacy
0.00022038173631262558, Cooking with Style, Cooking
0.00022029147903601152, Explore Kun-Lai Summit, Pandaria
0.00022018988014580674, Digger, Archaeology
0.00021964428250927982, Nemesis: Manslayer, Draenor Garrison
0.00021957412280458578, The Diplomat, Reputation
0.00021955087465645753, Operation Counterattack, Ashran
0.00021942553671212365, Who Needs Bloodlust?, Lich King Raid
0.00021935426722465863, Crashin' Thrashin' Racer, Events
0.0002193480539462201, Three Car Garage, Lich King Raid
0.0002192981687517831, Heroic: Blood in the Snow, Pandaria Scenarios
0.00021927435856831362, Take Cover!, Draenor Dungeon
0.00021913616534855146, Jorundall Justice, Island Expeditions
0.00021893606245047454, Gate of the Setting Sun Challenger, Dungeons
0.00021881265442276216, Perma-Peddle, Love is in the Air
0.00021850532233062662, Step Right Up, Darkmoon Faire
0.00021839450572610456, Heroic: Sethekk Halls, The Burning Crusade
0.00021832157100021055, Greedy, Legacy
0.00021830324172708598, Not So Fast, Warsong Gulch
0.00021826826664074, Jungle Treasure Hunter, Draenor
0.00021817450933077294, Heroic: Jin'rokh the Breaker, Pandaria Raid
0.00021812402823021638, Explore Spires of Arak, Draenor
0.00021804500725497485, Archavon the Stone Watcher (10 player), Wintergrasp
0.00021803633603360598, Conqueror of Orgrimmar, Pandaria Raid
0.00021790450212795078, Realm First! Level 80 Night Elf, Feats of Strength
0.0002178817815093343, Stormstout Brewery: Gold, Dungeons
0.00021787916828452881, Grimrail Depot, Draenor Dungeon
0.00021776947807853177, Explore Howling Fjord, Northrend
0.0002176959794942172, Silence is Golden, Cataclysm Raid
0.00021763160934832105, Unbound Monstrosities, Battle Raid
0.000217608125460661, Deadly Gladiator's Frost Wyrm, Mounts
0.00021756942919000982, Pinnacle of Storms, Pandaria Raid
0.0002175320774703838, Bounty of Pandaria, Pandaria
0.0002174460714447653, Heroic: Tortos, Pandaria Raid
0.00021735059908167188, Pro Toss, Draenor Raid
0.000217277736401001, Ogre Invasion, Draenor Garrison
0.00021725210766974974, Mythic: The Everbloom, Draenor Dungeon
0.00021723869370657907, Dreadsteed of Xoroth, Legacy
0.00021714668842134736, Rubble and Roll, Lich King Raid
0.0002171236102324359, Naval Treasure Specialist, Draenor Garrison
0.00021709998052704484, Rocketeer: Gold, Darkmoon Faire
0.00021709969578648513, But I'm On Your Side, Lich King Raid
0.00021704986138848696, Shadowmoon Clan Invasion, Draenor Garrison
0.00021690946044252945, Petty Officer, Draenor Garrison
0.00021674858307046705, Destroyer's End, Cataclysm Raid
0.00021668348935697756, Explore Vale of Eternal Blossoms, Pandaria
0.00021656282812186292, Flame Warden of the Broken Isles, Midsummer
0.00021655421171530795, Western Plaguelands Quests, Eastern Kingdoms
0.00021649427508351078, Brawlin' and Shot Callin' (Season 2), Legacy
0.0002164363863217398, Call of the Crusade (10 player), Lich King Raid
0.00021642977013971995, Tabard of the Argent Dawn, Events
0.00021628408665640313, Heroic: The Plagueworks (10 player), Lich King Raid
0.00021624498169343974, Can't Do That While Stunned (10 player), Raids
0.0002162017260369336, Not an Ambi-Turner, Cataclysm Raid
0.00021593707177382067," Earth, Wind & Fire (25 player)", Lich King Raid
0.0002159243573048716, Jungle Hunter, Draenor
0.00021590244750608175," Nausea, Heartburn, Indigestion... (10 player)", Lich King Raid
0.00021589802248339653, Dwarfageddon, Lich King Raid
0.00021579936529472803, Gamon Will Save Us!, Pandaria Raid
0.00021572031454391267, Skyshattered, The Burning Crusade
0.00021571601101589405, Green Brewfest Stein, Events
0.00021565631261454758, King of the Guild (Season 3), Legacy
0.0002155984726700113, Scarlet Monastery: Gold, Dungeons
0.00021552278369389968, Argent Aspiration, Argent Tournament
0.00021544129137478864, Halls of Stone, Lich King Dungeon
0.00021534600540928158, Polished Pet Charmer, Pet Battles
0.00021527055850898642, You Don't Have an Eternity (25 player), Lich King Raid
0.00021506112066039986, Chromie Homie, Legion
0.00021503948507740748, Chapter IV: Celestial Blessings, Legacy
0.00021502936422428516, Knight-Captain, Player vs. Player
0.00021481757042133694, Sergeant Major, Rated Battleground
0.0002147224989233948, None Shall Pass, Pandaria Raid
0.00021458460119182593, The Sword in the Skull, Argent Tournament
0.00021429788639314767, Temper Tantrum, Battle Raid
0.0002142267356578753, Wanderluster: Silver, Darkmoon Faire
0.00021404783539065602, Prize Fighter, World
0.00021403607212081843, Veteran: Neri Sharpfin, Battle for Azeroth
0.0002140083932632645, Fa-la-la-la-Ogri'la, Winter Veil
0.0002139554273865945, Sinister Calling, Hallow's End
0.00021393188059693838, Grimrail Depot: Gold, Dungeons
0.00021384432061146173, Burning Steppes Quests, Eastern Kingdoms
0.0002137173279050137, Explore Teldrassil, Kalimdor
0.00021369120793779075, Been Waiting a Long Time for This (25 player), Lich King Raid
0.0002136837743851786, Scholomance Challenger, Dungeons
0.00021363578003086157, Clean House, Legion Dungeon
0.00021336040834689797, I've Got the Biggest Brawls of Them All (Seaso..., Legacy
0.0002133140127595136, Nine Lives, Lich King Raid
0.0002132793759157332, Corporal, Player vs. Player
0.00021323696877632688, Strange Brew, Brewfest
0.0002131751643725102," Sorry, Were You Looking for This?", Pandaria Raid
0.00021308661465415095, Explore Hellfire Peninsula, Outland
0.00021300793382039273, Veteran: Hunter Akana, Battle for Azeroth
0.00021287403556132919, It's a Trap!, Pandaria Scenarios
0.00021286600906488166, Darkmoon Racer Roadhog, Darkmoon Faire
0.00021265815247141666, My Very Own Broodmother, Cataclysm
0.000212488409865835, Archavon the Stone Watcher (25 player), Wintergrasp
0.00021242463017398272, Mogu'shan Palace: Gold, Dungeons
0.00021226056500530486, The Everbloom Challenger, Dungeons
0.00021216383719572642, The Second Rule of Brawler's Guild (Season 3), Legacy
0.0002119992044430072, Flame Keeper of Northrend, Midsummer
0.0002115215911244076, It's Just a Flesh Wound, Argent Tournament
0.00021150459772988742, Don't Let the Tala-door Hit You on the Way Out, Draenor
0.00021140535587594136, Deforestation, Lich King Raid
0.00021136489433316118, My Item Level Is Higher than Yours, Draenor Garrison
0.00021111285117485996, Veteran: Vim Brineheart, Battle for Azeroth
0.00021102038771415743, Auchindoun: Gold, Dungeons
0.00021100015945137735, Legion Archaeologist, Archaeology
0.0002109663429974472, Explore Zangarmarsh, Outland
0.00021093097535482882, Who's Got Two Green Thumbs?, Pandaria Raid
0.0002109180928630722, Now You're Just Showing Off (Season 2), Legacy
0.00021072720130351077," Many Many Missions, Handle It!", Legion Class Hall
0.00021065082890222854, Explore Desolace, Kalimdor
0.00021059330483917422, Not-So-Friendly Fire, Lich King Raid
0.0002102850018496686, Ahead of the Curve: Imperator's Fall, Raids
0.000210278067273714, Un'Goro Crater Quests, Kalimdor
0.00021023196296515392, Ahead of the Curve: Helya, Raids
0.00021020355320789318, Pair Annihilation, Draenor Raid
0.00021011298118881296, Lunar Festival Finery, Lunar Festival
0.0002100842097100068, Deep into Deepholm, Cataclysm
0.00021005047098386344, Scarlet Monastery Challenger, Dungeons
0.00020992530133129018, Hotter Streak, Arena
0.00020992108968925078, Siege of Niuzao Temple Challenger, Dungeons
0.00020991629425463304, Cutting Edge: Will of the Emperor, Raids
0.00020981782169287994, The Dread Approach, Pandaria Raid
0.00020979570631367062, Powermonger: Bronze, Darkmoon Faire
0.00020977009613829794, Halls of Flesh-Shaping, Pandaria Raid
0.0002097578608347294, Shadowmoon Burial Grounds: Gold, Dungeons
0.00020974435825352062, Doomsoul Surprise, Battle for Azeroth
0.00020965396583893684, Extinguishing Draenor, Midsummer
0.00020958546084195315, Blue Brewfest Stein, Events
0.00020931729123419652, Seething Shore Perfection, Seething Shore
0.00020924170887936033, Breaker of the Black Harvest, Feats of Strength
0.00020921030021715657, Cutting Edge: The Black Gate, Raids
0.00020919678515130596, Master of the Grill, Cooking
0.00020890328715416736, Into the Basin, Northrend
0.00020861353660096778, Naval Treasure Expert, Draenor Garrison
0.00020852363692539378, Nothing Boring About Borean, Northrend
0.00020849982267994948, Chapter I: Trial of the Black Prince, Legacy
0.00020842209424896745, Mighty Roamin' Krasaranger, Pandaria
0.00020837823671061124, Chapter V: Judgment of the Black Prince, Legacy
0.00020837147546923994, Explore Stonetalon Mountains, Kalimdor
0.00020810958421530498, Stonetalon Mountains Quests, Kalimdor
0.00020810855057294943, Realm First! Grand Master Miner, Feats of Strength
0.00020783321676610283, Heroic: Shadow Labyrinth, The Burning Crusade
0.0002077378306942635, Frontline Veteran, World
0.00020759885941666536, Flame Keeper of the Broken Isles, Midsummer
0.00020757923635134304, Skyreach: Gold, Dungeons
0.00020739785035406497, Armed for Action, Battle for Azeroth
0.00020722936378077681, Zalazane's Fall, Events
0.00020721788346870132, Full of Sound and Fury, Cataclysm Raid
0.0002071745664090546, The Rarer the Better, Draenor Garrison
0.00020693175663695805, Challenge Conqueror: Silver, Dungeons
0.00020691205536919053, Chocolate Lover, Noblegarden
0.00020687594516590252, Second That Emotion, Cooking
0.00020687506297560577, All Over the Isle, Isle of Conquest
0.00020664544105802277, Extinguishing Pandaria, Midsummer
0.00020662381450300269, Come On and Slam, Battle for Azeroth
0.00020609888272932406, Seasoned: Poen Gillbrack, Battle for Azeroth
0.00020608471662688483, A Poke in the Eye (25 player), Lich King Raid
0.00020591992880482552, King of the Mountain, Cataclysm
0.0002058865680601009," ""FOOD FIGHT!""", Pilgrim's Bounty
0.00020587042230348562, The Northrend Gourmet, Cooking
0.00020582080970053026, Deforestation (10 player), Raids
0.0002057498635344285, Explore Eversong Woods, Eastern Kingdoms
0.00020569575617278952, Echoes of Doomfire, Draenor Raid
0.00020559221170674276, Explore Bloodmyst Isle, Kalimdor
0.00020548739919248323, Grimrail Depot Challenger, Dungeons
0.0002054407972111637, Rally the Valley, Pandaria
0.0002054407656258588, Realm First! Grand Master Herbalist, Feats of Strength
0.0002051480319403489, Chapter IV: Darkness Incarnate, Legacy
0.00020505462458457544, Parasite Evening, Cataclysm Raid
0.00020498781842477314, Invasions Are Better with Friends, Draenor Garrison
0.00020487332802707192, Flame Warden of Draenor, Midsummer
0.00020486769756577155, Realm First! Grand Master Scribe, Feats of Strength
0.00020486028905526363, Flame Keeper of Zandalar, Midsummer
0.00020480228593431287, Cutting Edge: Xavius, Raids
0.00020449434941484946, Test Drive, Pandaria
0.00020429860087066312, Heroic: Dark Heart of Pandaria, Pandaria Scenarios
0.00020422410180324368, Challenge Warlord: Silver, Dungeons
0.00020408452834291797, Cruel Gladiator's Storm Dragon, Mounts
0.0002040334194314136, The Bastion of Twilight, Cataclysm Raid
0.00020379130610154498, The Keg Runner, Pandaria Scenarios
0.00020352913355425339, Explore Terokkar Forest, Outland
0.00020351895631654155, General, Player vs. Player
0.0002034611995739752, 25 Cooking Awards, Cooking
0.0002034111373971318, Deforestation (25 player), Raids
0.00020338413672001953, Chocoholic, Noblegarden
0.00020323893850665182, Sinking into Vashj'ir, Cataclysm
0.0002031236992623537, Staying Regular, Draenor Garrison
0.00020306867554205802, Ancient Protector, Player vs. Player
0.00020302086933773818, In Pursuit of Gul'dan, Draenor
0.00020300469855936068, Hinterlands Quests, Eastern Kingdoms
0.00020295241977915738, Non-Lethal Enforcer, Draenor Raid
0.00020283512532570858, Can't Stop Won't Stop, Temple of Kotmogu
0.0002027749485195938, Calavera, World Events
0.0002027130512459365, Challenge Warlord: Bronze, Dungeons
0.00020268900044144366, Between Arak and a Hard Place, Draenor
0.00020258809243509595, Master of the Wok, Cooking
0.000202535553910389, Disarmed (25 player), Raids
0.00020239800223855823, Naval Combat Specialist, Draenor Garrison
0.00020227126737172916, Iron Docks: Gold, Dungeons
0.00020209064342614175, Blackwing Descent, Cataclysm Raid
0.0002020843037293955, Ling-Ting's Herbal Journey, Pandaria Dungeon
0.00020206707528720188, Explore Azshara, Kalimdor
0.0002020148522425858, Getting Your Hands Dirty, Archaeology
0.000202013161272001, Mythic: Immerseus, Pandaria Raid
0.00020198788096929647, The First Rule of Ring of Blood is You Don't T..., Quests
0.00020185023639651266, Perfect Performance, Darkmoon Faire
0.00020181321269266916, She Deep Breaths More (10 player), Lich King Raid
0.00020161071914038251, Water Management, Draenor Dungeon
0.00020151245621238535, Prideful Gladiator's Cloud Serpent, Mounts
0.0002014349015529115, Realm First! Illustrious Alchemist, Feats of Strength
0.00020110225138159754, Emissary of Ordos, Pandaria
0.0002007612109511026, But I'm On Your Side (10 player), Raids
0.00020074972448632836, Challenge Conqueror: Gold, Dungeons
0.00020034842436741996, History of Violence, Draenor
0.00020032933727789343, Till the Break of Dawn, Pandaria
0.00020015473057789668, Badlands Quests, Eastern Kingdoms
0.00020004852970056418, Flame Warden of Pandaria, Midsummer
0.0002000365046621028, Collector: Pollen Collectors, Archaeology
0.00019965554579226503, Ready for Raiding VI, Battle Dungeon
0.000199525244518904, Heroic: Twin Consorts, Pandaria Raid
0.00019950200677882135, Journeyman Medic, Professions
0.00019937430387164236, Onyxia's Lair (10 player), Lich King Raid
0.0001993630440305637, The Second Rule of Brawler's Guild (Season 1), Legacy
0.00019915181827392456, Explore Twilight Highlands, Cataclysm
0.00019904251733022263, Chapter III: Two Princes, Legacy
0.00019891726145547075, Mythic: Garrosh Hellscream, Pandaria Raid
0.00019881543535133097, I Could Say That This Cache Was Rare (25 player), Raids
0.00019878477569204987, Scarlet Halls Challenger, Dungeons
0.000198601259837821, The Everbloom: Gold, Dungeons
0.00019858664752525087, Pecking Order, Battle Dungeon
0.00019855126051144734, Challenge Conqueror: Bronze, Dungeons
0.00019850607991452588, Mythic: Thok the Bloodthirsty, Pandaria Raid
0.0001983725231762657, High Warlord, Player vs. Player
0.00019827491265465112, There's Always a Bigger Train, Draenor Raid
0.00019820770715206092, The Abyss Will Gaze Back Into You, Cataclysm Raid
0.00019807263054240275, The Cake Is Not A Lie, Cooking
0.00019801491555845635, Grand Marshal, Player vs. Player
0.00019778672972461497, Extinguishing Northrend, Midsummer
0.00019764902844650572, Explore Krasarang Wilds, Pandaria
0.00019762618279720446, Sucker Punch, Island Expeditions
0.00019759919400897725, Achieve-a-tron, Cataclysm Raid
0.00019736034210565784, Sergeant, Player vs. Player
0.00019733201050353165, Ashenvale Quests, Kalimdor
0.0001972934310578193, Lieutenant General, Player vs. Player
0.0001972187953936283, From Dusk 'til Dawn, Pandaria Raid
0.0001971137654331396, Swallow Your Pride, Pandaria Raid
0.0001970136773079337, Master of the Oven, Cooking
0.00019688575559339216, War for the Wilds, Island Expeditions
0.00019679326039349822, Heroic: Horridon, Pandaria Raid
0.00019674150139031566, Three Sixty Pain Spike (25 player), Lich King Raid
0.00019666828245913886," The Few, the Proud, the Gob Squad", Pandaria Scenarios
0.00019653772778497627, You're Just Making It WORSE!, Legion Dungeon
0.00019651763169681687, Scout, Player vs. Player
0.0001965141930946881, Not-So-Friendly Fire (10 player), Raids
0.00019651263013419334, Beacon of Love, Love is in the Air
0.0001964381288902542, Ten Hit Tunes, Draenor Garrison
0.00019627809336477875, Could We Find More Like That?, Pandaria
0.00019620107314934787, Shado-Pan Monastery Challenger, Dungeons
0.00019612284234888638, Gate of the Setting Sun: Gold, Dungeons
0.00019610122675223606, Collector: Banners of the Mantid Empire, Archaeology
0.00019584589847613577, Extinguishing the Cataclysm, Midsummer
0.00019584193991590507, Heroic: The Steamvault, The Burning Crusade
0.00019578119354357693, Deepwind Gorge Perfection, Deepwind Gorge
0.00019559143770204326, Catering for Combat, Cooking
0.00019535983917307257, Realm First! Level 80 Gnome, Feats of Strength
0.00019527752299090855, Heroic: A Brewing Storm, Pandaria Scenarios
0.00019513736766764073," I'm In Your Base, Killing Your Dudes", Pandaria
0.00019512649912066207, Ghostlands Quests, Eastern Kingdoms
0.000195102619418054, In a Trail of Smoke, Pandaria
0.00019510009325637276, The Mind-Killer, Pandaria Raid
0.00019481439649830838," 20,000 Leagues Under the Sea", Cataclysm
0.0001948073091809722, Collector: Remains of Paragons, Archaeology
0.00019478930378288392, Naval Training Expert, Draenor Garrison
0.00019475937475472, Explore Arathi Highlands, Eastern Kingdoms
0.0001946667633498519, Elune's Blessing, Lunar Festival
0.00019466648694663877, Explore Icecrown, Northrend
0.00019462704241132012, Less Than Three, Pandaria Raid
0.00019445889196093727, In a Thousand Years Even You Might be Worth So..., Cataclysm
0.0001942155237930643, The Halls of Reflection, Lich King Dungeon
0.000194202702387989, Operation Counterattack, Ashran
0.0001941370501382665, Grand Ice Mammoth, Wrath of the Lich King
0.00019406341420156399, Peak Speed, Twin Peaks
0.00019396261189476817, Master Sergeant, Player vs. Player
0.00019394100583910008, Heroic: Council of Elders, Pandaria Raid
0.0001939171881890784, On the Blade's Edge, Outland
0.00019388061048469742, Collector: Kypari Sap Containers, Archaeology
0.0001938727791130724, Challenge Warlord: Gold, Dungeons
0.00019385744335820147, Is Draenor on Fire?, Draenor Dungeon
0.0001937793213089986, The Second Rule of Brawler's Guild (Season 1), Legacy
0.00019368014273038185, Surveying the Damage, Cataclysm
0.00019358983964204026, Mantid Swarm, Pandaria Dungeon
0.00019358100371811456, Iron Docks Challenger, Dungeons
0.00019355063220123403, Liberator of Orgrimmar, Pandaria Raid
0.00019341283203923827, First Sergeant, Player vs. Player
0.0001933391630552724, Champion of Darnassus, Argent Tournament
0.00019333790998988617, Collector: Ancient Sap Feeders, Archaeology
0.00019317857021155873, The Antechamber of Ulduar (10 player), Raids
0.000193128061761303, Pillars of Creation, Legion
0.0001931210206951494, Heroic: Megaera, Pandaria Raid
0.00019297866334210386, Brew of the Month, Brewfest
0.00019295014277549282, In Pursuit of Gul'dan, Draenor
0.0001928347541326819, Master of the Brew, Cooking
0.00019282124781873285, Sous Chef, Cooking
0.00019281985687046244, Light Travel, Archaeology
0.00019281320826889173, Knight, Player vs. Player
0.00019279740152615052, Explore Netherstorm, Outland
0.00019276511675556741, Cutting Edge: Kil'jaeden, Raids
0.0001926080408888149, The Garrison Campaign, Draenor
0.00019253838953308354," My Sack is ""Gigantique""", Collections
0.00019229041096977047, But You Say He's Just a Friend, Legion Dungeon
0.00019217051679435774, The Empire of Zul'Drak, Northrend
0.00019216332017992725, More Like Wrecked-us, Draenor Raid
0.00019208598199888904, Rabble Rabble Rabble (Season 2), Legacy
0.00019198975340108273, Collateral Damage, Pandaria
0.00019191197701937945, Two Lights in the Darkness (25 player), Raids
0.00019158330400120165, Heroic: Battle on the High Seas, Pandaria Scenarios
0.0001915719139618492, Mogu'shan Palace Challenger, Dungeons
0.00019156819411251795, Ahead of the Curve: Blackhand's Crucible, Raids
0.0001913105613446877, Newbs to Plowshares, Battle for Gilneas
0.0001912829198671555, Naval Bonus Specialist, Draenor Garrison
0.0001911568830927258, Deck Defender, Cataclysm Raid
0.0001910632942545264, Explore Azuremyst Isle, Kalimdor
0.00019094367493044964, But I'm On Your Side (25 player), Raids
0.00019083660730387115, Relentless Gladiator's Frost Wyrm, Mounts
0.00019082587995258298, Mythic: Spoils of Pandaria, Pandaria Raid
0.00019081396101194362, Thousand Needles Quests, Kalimdor
0.00019080680000962028, Legionnaire, Player vs. Player
0.00019070560461660014, Stokin' the Furnace (25 player), Raids
0.00019068021559378635, Senior Sergeant, Player vs. Player
0.0001906065874788994, Been Waiting a Long Time for This (10 player), Lich King Raid
0.00019050913308249322, Blastenheimer Bullseye, Darkmoon Faire
0.00019041547680248078, Cutting Edge: Helya, Raids
0.0001903083133570524, Fleet Commander, Draenor Garrison
0.00019022922500994035, Challenge Conqueror, Dungeons
0.000190118244701006, King of the Fire Festival, Midsummer
0.00018994803714780754, The Forge of Souls, Lich King Dungeon
0.00018986037977748304, Realm First! Grand Master Engineer, Feats of Strength
0.0001897709133841473, Lumberjacked, Lich King Raid
0.00018973339576919816, Defender of Gods, Pandaria
